id,fund,name,slug,fund_url,sectors,website,description,stage,stage_year,founded_year,invested_year,logo_url,source_modified,ticker_symbol,acquirer,founders,pmo_score,pmo_traj,pmo_mat,pmo_collab,pmo_game,pmo_feedback,pmo_notes
78,a16z-speedrun,Spark Space,spark-space,https://speedrun.a16z.com/companies/spark-space,AI;Edtech,https://www.sparkspace.ai,"Spark Space: The AI Writing Tutor That Truly Connects with Students
Students LOVE Spark Space because it feels like a real tutor who understands them—their interests, their struggles, and their passions. More than just an AI, it bonds with them like a friend, making writing feel personal, engaging, and even fun. With a gamified experience inspired by Duolingo and their favorite video games, students see instant progress, keeping them motivated and excited to improve. And most importantly, Spark Space helps them get better at writing, giving immediate feedback so they can build confidence and earn higher grades.

Teachers LOVE Spark Space because it makes students actually excited to write. The AI tutor provides powerful insights into student writing, helping teachers focus on what matters most. And with automated draft grading, it saves hours of time—allowing teachers to spend less time grading and more time inspiring their students.",SR003,,2024.0,,https://speedrun-prod-media.s3.amazonaws.com/companies/d33e613c-f166-4dbe-bcdb-3f20dc673f77/logos/Square_PROFILE_PICTURE.jpg,,,,David Vinca;Kira Yang,5.8,3,7,2,8,9,"Стартап фокусируется на геймификации и персонализированной обратной связи, но не предоставляет учащемуся возможности создавать собственную траекторию обучения или значимые социальные взаимодействия."
167,a16z-speedrun,Prepp,prepp,https://speedrun.a16z.com/companies/prepp,AI;Edtech,,"We develop student- and educator-focused modules that solve both administrative and content-driven issues from material generation, automatic grading, attendance, and student engagement.",SR005,,2025.0,,https://speedrun-prod-media.s3.amazonaws.com/companies/4c581ace-f3dd-45f9-84cc-ff6d6cc6e92d/logos/Screenshot_2025-10-06_at_11.48.04PM.png,,,,Eric Tang;Simon Yang,5.0,2,7,4,5,7,"Продукт фокусируется на административных задачах и генерации материалов, имеет адаптивное оценивание и элементы геймификации, но не предоставляет ученикам возможности создания собственной учебной траектории."
233,a16z-speedrun,Straia,straia,https://speedrun.a16z.com/companies/straia,AI;Edtech;Enterprise SaaS,https://straia.io,"$4.5M committed ARR* in 4 weeks.

Straia is the agentic AI platform replacing legacy software across higher education. We unify siloed institutional data and deploy AI agents to analyze and act on that data.

Building the AI-native operating system for every college in America.

*In contracting",SR006,,2025.0,,https://speedrun-prod-media.s3.amazonaws.com/companies/64d25e00-80d7-474d-a6c4-d66cb4136c00/logos/straia_logo_rounded_square.png,,,,Ryan Lau;Alan Chan;Gautam Narasimhan;Nikki Dansey,3.6,4,4,2,2,6,"Straia ориентирована на административные данные и AI-агентов для вузов, а не на персонализацию учебного процесса студента."
1081,brighteye,Seven Education,seven-education,https://www.brighteyevc.com/portfolio,Learning,https://www.7education.com/,The operating system for schools & nurseries,,,,,https://cdn.prod.website-files.com/6924982cd85cbab57fe65dd1/69ca952f31d8043b6eb633e8_seven_education.avif,,,,,2.8,2,3,4,2,3,"Seven Education — это операционная система для школ, которая предоставляет базовые возможности управления, но не реализует персонализацию траекторий, адаптивный контент, геймификацию или развитую обратную связь, что ограничивает её соответствие модели PMO."
1082,brighteye,Ornikar,ornikar,https://www.brighteyevc.com/portfolio,Learning,https://www.ornikar.com/,"The all-in-one platform for learning to drive, finding instructors and getting insured.",,,,,https://cdn.prod.website-files.com/6924982cd85cbab57fe65dd1/695eb47a1d10b4e3d9113eaf_ornikar_logo_white.avif,,,,,4.8,4,5,6,5,4,"Ornikar предоставляет некоторый выбор последовательности обучения и материалов, а также социальное взаимодействие с инструкторами, но персонализация траектории и обратной связи ограничена."
1132,edu-capital,appscho,appscho,https://www.educapitalvc.com/portfolio,Future of education,https://www.appscho.com/,Application for school management for students,Acquired,,,,https://cdn.prod.website-files.com/63d0f27ecbdecd6f9b9827d1/647077b29be7214cf9b47e2f_Appscho_.png,,,,,2.8,2,2,4,3,3,"Продукт ориентирован на управление школой, а не на персонализированное обучение, поэтому все компоненты PMO имеют низкие оценки."
1133,edu-capital,buddy,buddy,https://www.educapitalvc.com/portfolio,Future of education,https://buddy.ai/fr/,AI-based language tutor for children,,,,,https://cdn.prod.website-files.com/63d0f27ecbdecd6f9b9827d1/672a40aa344dc01f8f7d80fd_FOTO-WEB-BUDDY-INGLES-2.jpg,,,,,5.2,3,6,2,7,8,"Продукт ориентирован на адаптивное обучение языку с геймификацией и персонализированной обратной связью, но не предоставляет ребенку возможностей для построения собственной траектории и совместной деятельности."
1135,edu-capital,codary,codary,https://www.educapitalvc.com/portfolio,Future of education,https://codary.org,Online coding for children,,,,,https://cdn.prod.website-files.com/63d0f27ecbdecd6f9b9827d1/64707740a61024d9b3fca741_Complori_V2.png,,,,,5.8,5,6,5,7,6,"Сервис предлагает персонализированный подход к обучению детей программированию с элементами геймификации и адаптации материалов, но имеет ограниченные возможности для совместной деятельности и построения индивидуальной траектории."
1137,edu-capital,digischool,digischool,https://www.educapitalvc.com/portfolio,Future of education,https://www.digischool.fr,Educational apps for K12 and Higher Ed,,,,,https://cdn.prod.website-files.com/63d0f27ecbdecd6f9b9827d1/647073ce9be7214cf9b0b019_DigischoolV2.png,,,,,2.2,2,3,1,3,2,"Продукт представляет собой набор образовательных приложений без明显ной персонализации траектории, адаптации контента или социальных функций."
1139,edu-capital,opendigitaleducation,opendigitaleducation,https://www.educapitalvc.com/portfolio,Future of education,https://opendigitaleducation.com/index.php?lang=fr,The social network for schools,Acquired,,,,https://cdn.prod.website-files.com/63d0f27ecbdecd6f9b9827d1/649c626e1dcf2a29a3751159_ODE%20DEVIENT%20EDIFICE%202.png,,,,,4.6,3,4,9,3,4,"Продукт акцентирует социальное взаимодействие как ключевой элемент, но остальные компоненты PMO развиты слабо."
1140,edu-capital,emma,emma,https://www.educapitalvc.com/portfolio,Future of education,https://apps.apple.com/fr/app/emma-parler-anglais/id6737470910,Conversational AI for language learning,,,,,https://cdn.prod.website-files.com/63d0f27ecbdecd6f9b9827d1/6940005565c084460918d2e2_Capture%20d%E2%80%99e%CC%81cran%202025-12-15%20a%CC%80%2013.34.07.png,,,,,5.2,2,7,3,5,9,"Стартап использует ИИ для адаптации учебных материалов и мгновенной обратной связи, но не позволяет учащемуся создавать собственную траекторию обучения, а социальные функции ограничены."
1141,edu-capital,engageli,engageli,https://www.educapitalvc.com/portfolio,Future of education,https://www.engageli.com,The “Zoom” for education,,,,,https://cdn.prod.website-files.com/63d0f27ecbdecd6f9b9827d1/647078250076accc99069171_Engageli_%202.png,,,,,3.4,2,2,9,1,3,"Продукт ориентирован на совместную деятельность в реальном времени, но почти не предлагает персонализации траектории, контента или геймификации."
1142,edu-capital,evidenceb,evidenceb,https://www.educapitalvc.com/portfolio,Future of education,https://evidenceb.fr,Adaptive learning platform for K12,,,,,https://cdn.prod.website-files.com/63d0f27ecbdecd6f9b9827d1/647074e76b25b30b3bb95f61_EvidenceB_B2.png,,,,,3.8,2,7,0,5,5,"Платформа адаптивного обучения для K12 показывает средний уровень персонализации материалов, но отсутствие элементов совместной работы и индивидуальной траектории."
1143,edu-capital,femaleinvest,femaleinvest,https://www.educapitalvc.com/portfolio,Future of education,https://www.femaleinvest.com,Financial education for women,,,,,https://cdn.prod.website-files.com/63d0f27ecbdecd6f9b9827d1/640082e5ce03bf6283cf09b9_female%20invest.png,,,,,3.4,2,4,6,3,2,"Продукт ориентирован на нишевую аудиторию с базовыми элементами совместного обучения, но без персонализации траектории, адаптивного контента, геймификации и обратной связи."
1144,edu-capital,fourthrev,fourthrev,https://www.educapitalvc.com/portfolio,Future of education,https://fourthrev.com,Online courses by tech companies and uni,,,,,https://cdn.prod.website-files.com/63d0f27ecbdecd6f9b9827d1/66fa9d501d0bf8d4616a5ac8_fourth%20rev.webp,,,,,3.0,3,4,3,2,3,"Продукт предлагает статичные онлайн-курсы от вузов и компаний с базовыми возможностями персонализации, но без глубокой адаптации траектории, геймификации или обратной связи."
1146,edu-capital,prepacademy,prepacademy,https://www.educapitalvc.com/portfolio,Future of education,https://www.prepacademy.fr,Online training for jobs facing talent shortage,,,,,https://cdn.prod.website-files.com/63d0f27ecbdecd6f9b9827d1/66e2f24df54bfde447f1fe9d_hupso1.png,,,,,3.0,3,4,3,2,3,"Стартап предлагает онлайн-обучение, но без явных механизмов персонализации траектории, адаптивного контента, геймификации или интерактивной обратной связи."
1148,edu-capital,knowunity,knowunity,https://www.educapitalvc.com/portfolio,Future of education,https://knowunity.co.uk,AI learning companion,,,,,https://cdn.prod.website-files.com/63d0f27ecbdecd6f9b9827d1/64707985a93d52282e9b98de_Knowunity%202.png,,,,,3.0,2,5,3,2,3,"Продукт в основном предоставляет статичные учебные материалы с базовыми элементами социального взаимодействия, но не предлагает персонализированных траекторий или геймификации."
1149,edu-capital,labster,labster,https://www.educapitalvc.com/portfolio,Future of education,https://www.labster.com/,Immersive platform for science learning,,,,,https://cdn.prod.website-files.com/63d0f27ecbdecd6f9b9827d1/63feac5049df0bb8d9eb3feb_Labster.png,,,,,4.6,2,7,2,8,4,"Labster обеспечивает адаптацию контента и геймификацию, но слабо реализует персонализацию траектории, совместную деятельность и обратную связь."
1150,edu-capital,lalilo,lalilo,https://www.educapitalvc.com/portfolio,Future of education,https://lalilo.com,AI to teach children to read,Acquired,,,,https://cdn.prod.website-files.com/63d0f27ecbdecd6f9b9827d1/64708388a558edee241824b4_lalilo_V2.png,,,,,5.6,2,8,3,7,8,"Основной фокус на адаптации учебных материалов и обратной связи с помощью ИИ, но траектория обучения и совместная деятельность развиты слабо."
1152,edu-capital,livementor,livementor,https://www.educapitalvc.com/portfolio,Future of education,https://www.livementor.com,Online school for entrepreneurship,,,,,https://cdn.prod.website-files.com/63d0f27ecbdecd6f9b9827d1/63feac896923915bc20c0717_Livementor.png,,,,,6.0,7,6,8,4,5,"Livementor предлагает персонализированные траектории и сильные коллаборативные элементы через менторские проекты, но геймификация и обратная связь остаются на среднем уровне."
1153,edu-capital,lunii,lunii,https://www.educapitalvc.com/portfolio,Future of education,https://lunii.com/fr-fr/,Screen-free story teller for children,,,,,https://cdn.prod.website-files.com/63d0f27ecbdecd6f9b9827d1/64707c4de005606711efc9e7_Lunii_V2.png,,,,,0.0,0,0,0,0,0,"Продукт не соответствует критериям PMO, так как представляет собой простое устройство для прослушивания аудиоисторий без образовательной персонализации или интерактивности."
1154,edu-capital,makers,makers,https://www.educapitalvc.com/portfolio,Future of education,https://makers.tech,Code learning bootcamp,,,,,https://cdn.prod.website-files.com/63d0f27ecbdecd6f9b9827d1/64707c7c5fcdb6b4d0e1c5ac_Makers_V2.png,,,,,4.0,2,3,6,4,5,Курс по программированию имеет фиксированный учебный план с базовой персонализацией контента и умеренными элементами коллаборации.
1156,edu-capital,mentorshow,mentorshow,https://www.educapitalvc.com/portfolio,Future of education,https://mentorshow.com,Online courses by celebrity mentors,,,,,https://cdn.prod.website-files.com/63d0f27ecbdecd6f9b9827d1/63feac087891d5c6206a4238_Mentor%20Show.png,,,,,2.8,2,3,4,2,3,"Продукт предлагает курсы от знаменитых наставников, но не предоставляет персонализированных траекторий, адаптивного контента или геймификации, ограничиваясь базовыми возможностями общения и обратной связи."
1159,edu-capital,myedspace,myedspace,https://www.educapitalvc.com/portfolio,Future of education,https://myedspace.co.uk/,1-to-Many tutoring via live sessions,,,,,https://cdn.prod.website-files.com/63d0f27ecbdecd6f9b9827d1/6682c5a1a7a6647314d95d5e_Design%20sans%20titre-2.png,,,,,1.6,0,0,5,0,3,"Сервис предлагает только групповые живые занятия без персонализации траектории, адаптивных материалов, геймификации и автоматизированной обратной связи."
1160,edu-capital,nolej,nolej,https://www.educapitalvc.com/portfolio,Future of education,https://nolej.io/,AI toolbox for teachers,,,,,https://cdn.prod.website-files.com/63d0f27ecbdecd6f9b9827d1/679a1fd64f49ca437eb7b974_logo_nolej_800x800.jpg,,,,,3.6,2,7,3,1,5,"Инструмент для учителей, не для учеников — персонализация траектории и геймификация отсутствуют, но материалы могут адаптироваться через ИИ."
1161,edu-capital,oclock,oclock,https://www.educapitalvc.com/portfolio,Future of education,https://oclock.io,Online coding school,,,,,https://cdn.prod.website-files.com/63d0f27ecbdecd6f9b9827d1/65d728fee853114535985790_Logo%20Dark%20HD%20(1).png,,,,,3.0,2,3,3,4,3,Онлайн-школа программирования без явных персонализированных траекторий и глубокой адаптации контента.
1162,edu-capital,powerz,powerz,https://www.educapitalvc.com/portfolio,Future of education,https://powerz.tech/fr-fr/,Fortnite for education,,,,,https://cdn.prod.website-files.com/63d0f27ecbdecd6f9b9827d1/65d72897e29da4211b5e6059_powerz_big_orange%20(1).png,,,,,4.8,3,4,6,8,3,"Стартап фокусируется на геймификации, но не предлагает персонализации траектории, контента или обратной связи."
1163,edu-capital,preply,preply,https://www.educapitalvc.com/portfolio,Future of education,https://preply.com,Tutoring marketplace for languages,,,,,https://cdn.prod.website-files.com/63d0f27ecbdecd6f9b9827d1/65d72491c770bb14e623f96f_Preply.jpeg,,,,,4.2,3,4,7,2,5,"Preply фокусируется на подборе репетиторов и индивидуальном общении, но не предоставляет инструментов для создания собственной траектории обучения или геймификации."
1165,edu-capital,web,web,https://www.educapitalvc.com/portfolio,Future of education,https://web.szl.ai/,AI tutor for students,Acquired,,,,https://cdn.prod.website-files.com/63d0f27ecbdecd6f9b9827d1/679a2518f886592359d31ca3_Capture_d_e%CC%81cran_2025-01-29_a%CC%80_13.53.44-removebg-preview.png,,,,,5.0,2,9,2,3,9,"Продукт фокусируется на адаптивном контенте и обратной связи с помощью ИИ, но не предлагает персонализированных траекторий или социального взаимодействия."
1166,edu-capital,studentpop,studentpop,https://www.educapitalvc.com/portfolio,Future of education,https://www.studentpop.fr,Student jobbing platform,,,,,https://cdn.prod.website-files.com/63d0f27ecbdecd6f9b9827d1/65d724d2072bac061e707b01_student%20pop%20logo.jpeg,,,,,3.0,2,2,7,1,3,"Платформа фокусируется на соединении студентов с работой, а не на персонализированном обучении."
1168,edu-capital,tomorrow,tomorrow,https://www.educapitalvc.com/portfolio,Future of education,https://www.tomorrow.university,Online University,,,,,https://cdn.prod.website-files.com/63d0f27ecbdecd6f9b9827d1/6470851e7d120de0b9f3b70d_Tomorrow%20University.png,,,,,2.2,2,2,5,0,2,"Стартап 'tomorrow' как онлайн-университет демонстрирует низкую персонализацию (фиксированные траектории и материалы), базовое взаимодействие, отсутствие геймификации и слабую обратную связь."
1169,edu-capital,vocal,vocal,https://www.educapitalvc.com/portfolio,Future of education,https://apps.apple.com/fr/app/vocal-image-coach-vocal-ia/id1535324205,Mobile AI coach for communication,,,,,https://cdn.prod.website-files.com/63d0f27ecbdecd6f9b9827d1/6940021ecbd37d3b81d356db_Capture%20d%E2%80%99e%CC%81cran%202025-12-15%20a%CC%80%2013.40.51.png,,,,,4.2,3,5,4,2,7,"Приложение фокусируется на ИИ-коучинге по коммуникации, но не предлагает полноценных персонализированных траекторий обучения или геймификации."
1170,edu-capital,wecandoo,wecandoo,https://www.educapitalvc.com/portfolio,Future of education,https://wecandoo.fr,Marketplace for craftship workshops,,,,,https://cdn.prod.website-files.com/63d0f27ecbdecd6f9b9827d1/6470837b6194e83c48c83a07_WeCanDoo_V2.png,,,,,3.4,3,3,5,4,2,"Продукт фокусируется на разовых мастер-классах без персонализации траектории и адаптации материалов, но имеет элементы совместной деятельности через групповые занятия и базовые визуальные подсказки."
1172,gsv-ventures,Abwaab,abwaab,https://gsv.ventures/portfolio/,Pre-K-12,https://abwaab.me/en,"Abwaab is an online learning platform that allows students to learn at their own pace, test themselves, and get ahead with our expert tutors anytime and anywhere. Abwaab offers short, engaging video lessons, visualized learning journeys, continuous assessment, and performance analytics.",Seed,,2019.0,2020.0,https://gsv.ventures/wp-content/uploads/2020/10/gsvventures-portfolio-abwaab-logo-small.png,,,,Hamdi Tabbaa;Hussein Al-Sarabi;Sabri Hakim,6.2,7,7,3,7,7,"Платформа предлагает персонализированные траектории обучения, адаптивный контент, геймификацию и обратную связь, но слабо развивает совместную деятельность."
1175,gsv-ventures,Amira Learning,amira-learning,https://gsv.ventures/portfolio/,K-12,https://www.amiralearning.com/,"Amira Learning is reinventing learning to read with AI. Leveraging AI innovation developed by and licensed from Carnegie Mellon University over 20+ years, Amira is an intelligent reading assistant able to assess, listen to and coach developmental readers. Just like a patient grandparent, Amira reads along with a child, helping to make reading practice productive. Just like the best teacher’s aide, Amira can assess oral fluency, tutor and generally make teacher’s life easier.",Series A,,2017.0,2019.0,https://gsv.ventures/wp-content/uploads/2020/11/gsvventures-portfolio-amiralearning-logo.png,,,,Mark Angel;CEO,5.6,4,7,3,5,9,"Amira Learning эффективно адаптирует процесс обучения чтению с помощью ИИ-тьютора и персонализированной обратной связи, но предоставляет ограниченные возможности для построения собственной траектории и совместной деятельности."
1176,gsv-ventures,Andela,andela,https://gsv.ventures/portfolio/,Future of Talent@Work,https://andela.com/,"In the next ten years, there will be 1.3M software development jobs created and only 400,000 domestic computer science graduates to fill them. Africa, meanwhile, is home to the largest untapped talent pool and seven of the 10 fastest growing internet populations in the world.",Seed,,2014.0,2014.0,https://gsv.ventures/wp-content/uploads/2020/11/andela-logo.png,,,,Jeremy Johnson;CEO & Co-Founder; Christina Sass;COO & Co-Founder,3.6,3,3,7,2,3,"Andela фокусируется на поиске талантов в Африке, но не предлагает персонализированных траекторий обучения, адаптивного контента или геймификации."
1179,gsv-ventures,Begin,begin,https://gsv.ventures/portfolio/,Future of Talent in PreK-12,https://www.speakaboos.com/,"BEGiN, the parent company of the Speakaboos and Homer early childhood literacy and language learning program, is on a mission to provide children the best educational start possible. The platform produces the industry’s highest engagement by combining two award-winning programs supporting “Love to Read” and “Learn to Read, and is the only company with two top 10 subscription services in the Kids and Education categories in the App Store and Google Play.",Series B,,2009.0,2014.0,https://gsv.ventures/wp-content/uploads/2020/11/gsvventures-portfolio-begin-logo.png,,,,Neal Shenoy;Co-Founder & COO; Noelle Millholt,5.0,2,8,3,7,5,"Отличная адаптация контента под уровень ребёнка, но траектория обучения задаётся программой, а не учеником."
1180,gsv-ventures,Bookclub,bookclub,https://gsv.ventures/portfolio/,Adult Consumer Learning,https://www.bookclub.com/,Bookclub enables life changing conversations through virtual book clubs led by the authors themselves.,Seed,,2020.0,2020.0,https://gsv.ventures/wp-content/uploads/2020/11/gsvventures-portfolio-bookclub-logo.png,,,,David Blake & Eric Sharp,3.8,2,3,9,2,3,"Продукт ориентирован на совместное обсуждение книг с авторами, что высоко оценивает коллаборацию, но остальные инструменты PMO слабо развиты, так как нет персонализации пути, адаптивного контента, геймификации и обратной связи."
