id,fund,name,slug,fund_url,sectors,website,description,stage,stage_year,founded_year,invested_year,logo_url,source_modified,ticker_symbol,acquirer,founders,pmo_score,pmo_traj,pmo_mat,pmo_collab,pmo_game,pmo_feedback,pmo_notes
1540,new-schools,"Ser Familia, Inc.",ser-familia-inc,https://www.newschools.org/venture/ser-familia-inc/,EDge,http://www.serfamilia.org,"Ser Familia is a non-profit organization empowering Latino families through educational programs, workshops, and retreats that allow them to thrive and enjoy a healthy family environment. Their holistic approach brings a sense of wholeness to people’s lives that allows them to improve their “now” and face “what’s next” with a positive outlook. Ser Familia recently launched an academic & overall well-being youth programming meets the growing mental health & educational needs by 1. addressing the widening educational & health/wellbeing gaps, 2. lack of digital/technology access, & 3. learning loss from COVID. All services, including tutoring, mentoring, physical activities, hands-on learning, life skills & career exploration, health/wellbeing sessions, & counseling are based on culturally/linguistically proficient model programming & proven-effective practices.",,,2001.0,2022.0,,,,,,3.8,3,4,7,2,3,"Программа ориентирована на социальное взаимодействие и совместные мероприятия, но индивидуальная траектория обучения, адаптивные материалы и геймификация практически отсутствуют."
1541,new-schools,SF Parent Coalition,sf-parent-coalition,https://www.newschools.org/venture/sf-parent-coalition/,Diverse Leaders,http://www.sfparents.org,"San Francisco (SF) Parent Coalition centers the needs of children and youth in San Francisco public schools by bringing together a diverse network of parents and caregivers to advocate for a thriving, equitable school system. SF Parent Coalition envisions a future where San Francisco is one of the best places in the country for children and youth of all races, socioeconomic backgrounds, and abilities to access and obtain an excellent public education.",Past,,2020.0,2023.0,,,,,,1.4,0,0,7,0,0,"Это скорее общественная организация для объединения родителей для адвокации, а не образовательная платформа, поэтому персонализация обучения, контент и игровые механики отсутствуют, однако есть значительный элемент социального взаимодействия и сотрудничества."
1542,new-schools,Sims-Fayola Foundation,sims-fayola-foundation-2,https://www.newschools.org/venture/sims-fayola-foundation-2/,Diverse Leaders,https://www.sffoundation.org/,"The Sims-Fayola Foundation was launched in 2014 as a 501(c)(3) to help change this narrative. We boldly accept the challenge to improve the lives of young men and boys of color by addressing the obstacles (educational and societal) that directly affect their life outcomes. We use original programming and awareness campaigns, partner with established community foundations and organizations, and individual schools and districts to address these stubbornly persistent issues for urban males. Our programs, services, mission, and values are driven by three pillars: 1. Building Awareness, 2. Building Equity by Design 3. Building Capacity. Our desired outcome is to provide direction, education, guidance, resources, direct support, and ultimately relief in these areas so the futures of these young men look like their dreams. The Sims-Fayola Foundation seeks to achieve their mission by launching a new fellowship designed to equip male teachers of color with equity-centered and gender-specific tools, resources, and support systems needed to increase their pedagogical knowledge and confidence.",,,2022.0,2022.0,,,,,,3.0,2,3,6,0,4,"Программа ориентирована на сообщество и менторство, но не предлагает персонализированных учебных траекторий или геймификации."
1543,new-schools,Sledge Institute,sledge-institute-2,https://www.newschools.org/venture/sledge-institute-2/,Innovative Schools,https://sledgeinstitute.org,"The Sledge Institute is a K-12 charter school in rural northeastern North Carolina’s Kerr Tar region. It connects curriculum to students’ lived experiences, offering opportunities to learn from industry professionals and reigniting exploration and wonder in education. With a learner-centered model based on six key elements, students explore essential questions like, “Why do I need to learn this?”, “When will I use this?”, and “What if…?”",Past,,,2024.0,https://www.newschools.org/wp-content/uploads/2024/10/Sledge-Institute-1.png,,,,,5.8,8,6,7,3,5,"Модель школы предполагает высокую степень персонализации траектории и коллаборации, но игровые механики и обратная связь не являются основными элементами."
1544,new-schools,Snorkl,snorkl-2,https://www.newschools.org/venture/snorkl-2/,"GenAI Math Tutoring,Learning Solutions",https://snorkl.app/,"Snorkl provides students with immediate, personalized feedback on their thinking and problem solving. Using its multimodal tools, students record visual and verbal explanations to show their reasoning and receive real-time support tailored to their work.",,,2023.0,2025.0,https://www.newschools.org/wp-content/uploads/2025/10/Snorkl-1.png,,,,,4.2,2,7,1,2,9,"Snorkl глубоко персонализирует обратную связь через ИИ, но почти не предоставляет ученику возможность создавать траекторию, сотрудничать или использовать геймификацию."
1545,new-schools,Social Cipher,social-cipher,https://www.newschools.org/venture/social-cipher/,Learning Differences,https://www.socialciphergame.com/,"Social Cipher builds social-emotional learning video games that help youth of all neurotypes understand themselves and those around them, and software that helps educators and counselors better understand their students’ social emotional well being.",Past,,2018.0,,https://www.newschools.org/wp-content/uploads/2022/12/Social-Cipher.png,,,,,5.2,2,5,6,9,4,"Продукт сильно опирается на геймификацию как основной механизм вовлечения, но траектория обучения фиксирована и слабая персонализация обратной связи."
1546,new-schools,Social Optics,social-optics,https://www.newschools.org/venture/social-optics/,Learning Differences,http://www.mysocialoptics.com,"Social Optics is a web based social communication solution for neurodivergent teens. We believe that understanding yourself and the science of communication is the foundation for positive self-esteem, relationships, and resilience. Social Optics allows schools to combine direct instruction, self-reflection and independent learning activities to help students develop authentic and empathetic communication skills.",Past,,,2023.0,https://www.newschools.org/wp-content/uploads/2023/09/Social_Optics_Full_Logo_TM-1024x384.jpg,,,,,5.2,3,6,8,4,5,"Социальная оптика предлагает персонализированные материалы и сильную совместную деятельность для нейроотличных подростков, но траектория обучения слабо настраивается, а геймификация и обратная связь ограничены."
1547,new-schools,South Shore Charter School,south-shore-charter-school,https://www.newschools.org/venture/south-shore-charter-school/,Innovative Schools,https://www.southshorecharterschool.org/,"South Shore Charter School’s mission is to cultivate in our students the tenacity, integrity, and curiosity needed to become innovative and socially responsible leaders, ready to face and solve the ever-changing challenges facing our society.",Past,,,2023.0,https://www.newschools.org/wp-content/uploads/2023/09/SSCS-logo5A.jpg,,,,,3.4,3,3,5,2,4,"Школа, ориентированная на воспитание лидеров, но не имеющая цифровых инструментов для персонализации обучения и геймификации."
1548,new-schools,Southern Nevada Black Educators Initiative,southern-nevada-black-educators-initiative-2,https://www.newschools.org/venture/southern-nevada-black-educators-initiative-2/,Diverse Leaders,https://www.snbei.org/,"The Southern Nevada Black Educators Initiative (SNBEI) addresses ongoing teacher recruitment and retention issues in Nevada by exposing the community to the uplifting impact of teachers of color and investing in human capital. SNBEI provides a continuum of support and advocacy to Black preservice and in-service educators through professional development services, critical mentorship, intentional recruitment and retention strategies and legislative advocacy in their Amplifying Black Voices Community Outreach initiative.",,,2022.0,2022.0,,,,,,3.6,3,3,7,1,4,"Инициатива сосредоточена на менторстве и сообществе, но не предоставляет персонализированных учебных траекторий или адаптивного контента."
1549,new-schools,"Sown To Grow, Inc",sown-to-grow-inc,https://www.newschools.org/venture/sown-to-grow-inc/,Learning Solutions,https://www.sowntogrow.com/,"Sown to Grow was part of the Expanded Definition of Student Success Ed Tech Challenge. Funds supported Sown to Grow’s student-led goal setting, reflection, and metacognition platform that builds better, more confident learners.",,,2015.0,2022.0,,,,,,5.4,7,3,4,5,8,"Платформа поддерживает учеников в постановке целей и рефлексии, что обеспечивает персонализированную траекторию и качественную обратную связь, но содержание материалов и совместная деятельность менее развиты."
1550,new-schools,Spelligent Education,spelligent-education,https://www.newschools.org/venture/spelligent-education/,Learning Differences,http://www.spelligent.org,"Spelligent seeks to ensure communities, caretakers, educators, and students understand how learners vary and understand how to attend to this variability in school and beyond. We do this by helping schools design school-wide systems that center learner variability, partnering with education support organizations to integrate the lens of learner variability into their programs, elevating voices through storytelling across multiple media platforms",Past,,2021.0,2023.0,https://www.newschools.org/wp-content/uploads/2023/09/spelligent.png,,,,,2.8,2,3,5,1,3,"Продукт ориентирован на системные изменения в школах, а не на персонализированное обучение отдельных учеников, поэтому инструменты PMO слабо применимы."
1551,new-schools,Springpoint,springpoint-2,https://www.newschools.org/venture/springpoint-2/,Learning Solutions,http://springpointschools.org,"Transformative Learning Experiences (TLEs) are project-based curricula that make high school meaningful. Developed by Springpoint, TLEs are deeply researched, youth-centered, informed by culturally responsive pedagogy, and richly supported for teacher implementation. Explicitly designed with both rigor and purpose in mind, TLEs focus on real-world problems that leverage students’ passions and speak to their interests and identities. They require students to engage in deep thinking and practice of essential post-secondary skills, create an authentic product, engage with experts and members of the community, and present their work to an authentic audience.",Past,,,2023.0,https://www.newschools.org/wp-content/uploads/2023/09/Springpoint-logo-2-1024x407.png,,,,,4.2,2,6,8,2,3,"Проектная программа с сильным акцентом на совместную работу и аутентичную аудиторию, но с фиксированным учебным планом и отсутствием геймификации и персонализированной обратной связи."
1552,new-schools,St. Louis Voices Academy of Media Arts,st-louis-voices-academy-of-media-arts,https://www.newschools.org/venture/st-louis-voices-academy-of-media-arts/,Innovative Schools,https://www.stlouisvoicesacademy.org/,"St. Louis Voices Academy of Media Arts is a free, public charter school that leverages media arts and storytelling to equip students with the agency to excel academically, author their own futures, and make meaningful contributions in their communities. SLVA is launching with kindergarten and first grade this fall and will grow a grade each year until fifth grade.",,,,2023.0,https://www.newschools.org/wp-content/uploads/2023/09/stlouis.png,,,,,3.6,2,3,6,4,3,"Школа делает акцент на медиаискусстве и сторителлинге, но как начальное учебное заведение с фиксированной программой пока не предлагает персонализированных траекторий и глубокой адаптации контента, при этом совместная работа над проектами может стать сильной стороной."
1553,new-schools,Start Lighthouse,start-lighthouse,https://www.newschools.org/venture/start-lighthouse/,Racial Equity,https://www.startlighthouse.org/,"Start Lighthouse, a 501(c)3 nonprofit founded in the Bronx, NY, is dedicated to advancing childhood literacy through a social justice lens. They achieve this through three key initiatives: Literacy Hubs, where abandoned library spaces are revitalized to serve as permanent homes for literacy programs; Literary Adventures, featuring interactive workshops led by BIPOC authors and illustrators to foster students’ love for reading and writing; and Home Libraries, providing students with diverse, free, and inclusive books each month to build their home libraries, ensuring representation in their reading materials.",Past,,,2023.0,https://www.newschools.org/wp-content/uploads/2023/09/Start-Lighthouse-Logo-—-Colorful-Circle-1024x1024.png,,,,,3.8,4,5,5,2,3,"Проект фокусируется на доступе к разнообразным книгам и воркшопам, но не предлагает персонализированных учебных траекторий, адаптивного контента, геймификации или автоматизированной обратной связи."
1554,new-schools,STEM4Real,stem4real,https://www.newschools.org/venture/stem4real/,Learning Solutions,http://www.stem4real.org,"​STEM4Real is committed to providing quality STEM professional learning infused with principles of equity, anti-bias and justice-centered pedagogy so that every student has access to a rigorous and joyful STEM education. We provide collaborative professional learning for educators committed to equity and anti-racism. We combine standards-based content + anti-racist pedagogy. Standards + Justice, you don’t have to choose. We use Lesson Study to CONNECT with our students, CREATE culturally responsive instruction and CULTIVATE a culture of anti-bias, anti-racism and belonging.",Past,,,2023.0,https://www.newschools.org/wp-content/uploads/2023/09/STEM4Real_FB-4-1024x1024.jpg,,,,,3.4,2,4,7,1,3,"Основной фокус на профессиональном развитии учителей и совместном обучении, но персонализация для учеников и геймификация отсутствуют."
1555,new-schools,Step Up Tutoring,step-up-tutoring-2,https://www.newschools.org/venture/step-up-tutoring-2/,"GenAI Math Tutoring,Learning Solutions",https://www.stepuptutoring.org/,"Step Up delivers virtual, high-impact 1:1 tutoring to underserved students in grades 2–6. It is developing two GenAI tools to help tutors improve instruction: a post-session feedback tool that reinforces effective practices and a real-time assistant supporting math explanations and relationship-building.",,,2020.0,2025.0,https://www.newschools.org/wp-content/uploads/2025/10/Step-Up-Tutoring-1.png,,,,,3.8,2,4,5,1,7,"Сервис фокусируется на индивидуальном репетиторстве с элементами ИИ-обратной связи, но почти не предоставляет ученикам возможностей выбора траектории, контента, геймификации или совместной деятельности."
1556,new-schools,"Stepmojo Education, LLC",stepmojo-education-llc,https://www.newschools.org/venture/stepmojo-education-llc/,EDge,https://coursemojo.com/about-us/,"Stepmojo supports students to take steps to increase their mojo (special talents). Stepmojo believes that the high school of the future embraces a blended learning approach – leveraging the best of a strong, in-person high school community with the best of online instruction, allowing us to radically expand the set of high-quality course options available to our young people. To facilitate this vision, they offer a diverse array of high-quality, live online courses from best-in-class partners through one easy-to-use platform. In their hybrid delivery model, classes are taught by engaging, expert online teachers from the course partners while an on-site learning coach or proctor at the school is circulating and supporting the learning in a classroom or communal space (e.g., library, study hall, etc.). Stepmojo’s goal is to provide students everywhere with more equitable access to exceptional content and teachers – giving them more agency to pursue personal interests, further academic goals, and explore potential college and career paths.",,,,2022.0,,,,,,4.8,7,5,6,2,4,"Stepmojo предлагает гибридную модель с выбором курсов и коучами-наставниками, но без геймификации и персонализированной обратной связи."
1557,new-schools,Strived.io,strived-io-2,https://www.newschools.org/venture/strived-io-2/,Learning Solutions,https://strived.io,"Strived.io is an AI-powered data tool for district leaders, school leaders, and teachers that collaborates with top Edtech vendors, assessment providers, and classroom data to generate actionable insights. By mapping student learning through integrated skills and standards, Strived.io helps educators coach each student effectively. It will also include behavior and emotional factors to provide a comprehensive understanding of how each child learns best.",Past,,,2024.0,https://www.newschools.org/wp-content/uploads/2024/10/Strivedio.png,,,,,3.4,3,4,2,1,7,"Инструмент в первую очередь аналитический, ориентирован на педагогов, а не на создание учащимися собственных траекторий или коллаборацию."
1558,new-schools,Substantial Classrooms,substantial-classrooms,https://www.newschools.org/venture/substantial-classrooms/,EDge,https://substantialclassrooms.org/,"Substantial was founded to unlock the potential of substitute teaching, one of the most overlooked, under-designed areas of public education. We developed SubSchool, our proven professional development platform, to provide substitute teachers with high-quality, tailored training and support. With SubSchool, we aim to cultivate the skills and confidence that make subs more effective in the classroom, and more likely to continue working in education.",Past,,,2023.0,https://www.newschools.org/wp-content/uploads/2023/09/Logo-Side-by-Side-1024x209.jpg,,,,,3.4,2,5,3,3,4,"Продукт фокусируется на профессиональном развитии замещающих учителей, но не включает создание или владение учениками собственной траекторией обучения, так как целевая аудитория — сами учителя, а не учащиеся."
1560,new-schools,"T.E.E.C.H. (Teaching for Equity, Empowerment and Community Healing)",t-e-e-c-h-teaching-for-equity-empowerment-and-community-healing-2,https://www.newschools.org/venture/t-e-e-c-h-teaching-for-equity-empowerment-and-community-healing-2/,Diverse Leaders,https://www.teeching.org/,"TEECH stands for Teaching for Equity, Empowerment and Community Healing. Unlike most existing teacher-training programs that do not prepare culturally responsive or justice-oriented teachers, TEECH aims to address the disconnect between school and students’ lives and their communities by training teachers as community workers and advocates, and by increasing their capacity to effectively serve the communities in which they teach. By drawing on their lived experiences and connections to community, TEECHers will be able to center their curriculum, practices, and relationships around culturally responsive practices—including the trajectory of leadership, policies and priorities of schools.",,,2021.0,2022.0,,,,,,3.2,2,3,7,1,3,"Проект ориентирован на социальное взаимодействие и сообщество, но не предлагает персонализацию учебных траекторий или геймификацию."
1561,new-schools,Tacoma Public Schools,tacoma-public-schools-2,https://www.newschools.org/venture/tacoma-public-schools-2/,Innovative Schools,https://tacomaschools.org,"Maritime 253 connects students from the south sound with maritime and skilled trades careers through hands-on learning, industry partnerships, and certification pathways, preparing a future-ready workforce for our region.",,,,2025.0,https://www.newschools.org/wp-content/uploads/2025/10/Tacoma-Public-Schools-1.png,,,,,5.0,6,5,7,3,4,"Инициатива Maritime 253 предлагает гибкие траектории через сертификационные пути и сотрудничество с отраслью, но контент и обратная связь недостаточно персонализированы, а геймификация отсутствует."
1562,new-schools,Talkido,talkido-2,https://www.newschools.org/venture/talkido-2/,Learning Solutions,https://talkido.co,"Talkido is a screen-free language support system designed to empower young learners with diverse needs in PreK to K5. Through a personalized approach, Talkido helps children build essential listening, attention, speaking, and literacy skills. Its accessible, interactive tools foster social and cognitive development, supporting children in reaching their full potential.",Past,,,2024.0,https://www.newschools.org/wp-content/uploads/2024/10/Talkido-1.png,,,,,5.4,5,7,3,6,6,"Продукт предлагает персонализированные материалы и игровые элементы, но совместная деятельность и создание собственной траектории развиты слабо."
1563,new-schools,Tampa Early College Academy,tampa-early-college-academy-2,https://www.newschools.org/venture/tampa-early-college-academy-2/,Innovative Schools,https://www.tampaearlycollegeacademy.org/,"Tampa Early College Academy (TECA) transforms learning for students in grades 6–12 through a rigorous early college model that blends middle and high school with college. TECA equips students with the skills, support, and academic foundation needed to succeed in college and career.",,,,2025.0,https://www.newschools.org/wp-content/uploads/2025/10/Tampa-Early-College-Academy-2.png,,,,,5.2,7,5,6,3,5,"Модель раннего колледжа предлагает индивидуальные траектории и элементы совместного обучения, но содержание и обратная связь слабо персонализированы, а геймификация минимальна."
