id,fund,name,slug,fund_url,sectors,website,description,stage,stage_year,founded_year,invested_year,logo_url,source_modified,ticker_symbol,acquirer,founders,pmo_score,pmo_traj,pmo_mat,pmo_collab,pmo_game,pmo_feedback,pmo_notes
1375,new-schools,Central Queens Academy,central-queens-academy,https://www.newschools.org/venture/central-queens-academy/,Innovative Schools,http://www.centralqueensacademy.org,"Central Queens Academy Charter Schools operate two schools in the heart of Queens, New York City, serving a diverse community of scholars. As the schools expand to enroll 1,800 students in grades K-8, they aim to equip students with the skills and knowledge needed to excel in education, thrive in the workforce, and contribute meaningfully to their communities.",Past,,2012.0,,https://www.newschools.org/wp-content/uploads/2024/12/Central-Queens-Academy.png,,,,,0.0,0,0,0,0,0,"Данные о продукте отсутствуют, поэтому оценить персонализацию по PMO невозможно."
1376,new-schools,ChattAcademy Community School,chattacademy-community-school-2,https://www.newschools.org/venture/chattacademy-community-school-2/,Innovative Schools,http://www.chattacademy.org,"In partnership with families, ChattAcademy Community School empowers students in grades 6-12 to explore their curiosity, build global competence through bilingual studies, make a positive impact on their communities, and develop strong character. The school prepares students to excel in the postsecondary opportunities of their choice.",Past,,2022.0,,https://www.newschools.org/wp-content/uploads/2024/12/ChattAcademy-Community-School.png,,,,,3.6,4,3,6,2,3,"Образовательная программа школы предполагает некоторую совместную деятельность и проектную работу, но отсутствуют персонализированные траектории, адаптивные материалы, геймификация и системная обратная связь."
1377,new-schools,Childhood Education International (CE International),childhood-education-international-ce-international,https://www.newschools.org/venture/childhood-education-international-ce-international/,Diverse Leaders,https://ceinternational1892.org/,"Childhood Education International (CE International) is committed to developing and amplifying innovative solutions to education challenges. CE International is launching the Refugee Educator Academy, an initiative dedicated to supporting prospective educators of color living in displacement, conflict, crisis, migration, and resettlement contexts. The Refugee Educator Academy will build a structured, supportive, and responsive pathway to teaching for people of refugee/immigrant backgrounds. In facilitated communities of practice, participants will follow a year-long journey that includes learning, micro-credentialing, mentorship, career exploration, and creation of personalized plans to reach career goals. This initiative will diversify the teacher workforce, address teacher shortages, improve education quality, and create more inclusive, culturally relevant schools.",,,2022.0,2023.0,https://www.newschools.org/wp-content/uploads/2023/09/CEI-Primary-Logo-Transparent-1024x237.png,,,,,6.4,8,6,9,2,7,"Программа делает акцент на создании персонализированных карьерных планов и сильном сообществе практики, но геймификация отсутствует."
1378,new-schools,CitySchools Collaborative,cityschools-collaborative-2,https://www.newschools.org/venture/cityschools-collaborative-2/,"GenAI Math Tutoring,Learning Solutions",,"CitySchools Collaborative catalyzes and scales school-based interventions. With support from NewSchools, it is developing Sophia, an AI tutor coach aligned to its proprietary math curriculum that provides tutors with real-time support to deliver stronger instruction.",,,2017.0,2025.0,https://www.newschools.org/wp-content/uploads/2025/10/CitySchools-Collaborative-1.png,,,,,4.2,3,4,7,2,5,"Продукт фокусируется на поддержке репетиторов через ИИ-коучинг, что усиливает совместную деятельность, но пока не предоставляет учащимся инструментов для создания собственной траектории обучения или геймификации."
1379,new-schools,Code Switch Restorative Justice for Girls of Color,code-switch-restorative-justice-for-girls-of-color-2,https://www.newschools.org/venture/code-switch-restorative-justice-for-girls-of-color-2/,Racial Equity,https://codeswitch.org/,"Code Switch Restorative Justice for Girls of Color (Code Switch) seeks to eradicate the inequities shaping the K-12 experiences of Black girls. Based on the belief that Black girls thrive when they feel seen, heard, and valued, Code Switch envisions K-12 schools as spaces where Black girls are free to be and become their authentic selves, are empowered to engage their unique ways of being, and are encouraged to imagine a future for themselves beyond the worlds they see before them.",,,,2022.0,,,,,,3.8,2,3,8,2,4,"Проект сосредоточен на социально-эмоциональной поддержке и сообществе, но не предлагает персонализированной учебной траектории, адаптивного контента или геймификации."
1380,new-schools,Cognitive ToyBox,cognitive-toybox,https://www.newschools.org/venture/cognitive-toybox/,Learning Differences,https://www.cognitivetoybox.com/,"Cognitive ToyBox develops game-based tools that make early childhood assessment efficient, actionable and equitable. Their mission is to help every child start school ready to succeed. Through the Learning Differences initiative, they are developing new research-based tools to support the assessment of social-emotional and executive functioning skills for 3-to-5 year old children.",Past,,2021.0,,https://www.newschools.org/wp-content/uploads/2022/12/Cognitive-Toy-Box.png,,,,,3.6,2,3,0,8,5,"Продукт ориентирован на оценку навыков через игры, но не предоставляет персонализированных траекторий обучения или совместной деятельности."
1381,new-schools,CommunityShare,community-share,https://www.newschools.org/venture/community-share/,Teaching Reimagined,https://www.communityshare.org/,"CommunityShare ignites civic engagement and a passion for learning by tapping into the wisdom and lived experiences of educators, students, and community members. Through collaboration, CommunityShare co-creates real-world learning experiences that build relationships, deepen understanding, and empower collective action.",Past,,2015.0,2024.0,https://www.newschools.org/wp-content/uploads/2024/10/CommunityShare-1.png,,,,,3.4,2,3,9,1,2,"Продукт сосредоточен на совместной деятельности с сообществом, но почти не предлагает персонализации траектории, адаптивных материалов, геймификации или обратной связи."
1382,new-schools,Convivir Colorado,convivir-colorado-2,https://www.newschools.org/venture/convivir-colorado-2/,Racial Equity,https://convivircolorado.org/,"2648 International Blvd Ste 301, Oakland, CA 94601  |    EIN: 94-3281780   |info@newschools.org|Accessibility Statement",,,,2022.0,,,,,,0.0,0,0,0,0,0,"Стартап не имеет образовательного контента или цифрового продукта, поэтому все инструменты PMO оценены в 0."
1383,new-schools,Coursemojo Inc.,coursemojo-inc-2,https://www.newschools.org/venture/coursemojo-inc-2/,Learning Solutions,https://www.coursemojo.com/,"Coursemojo empowers educators to meet the diverse needs of all students by providing accessible, interactive, and inclusive instructional materials. With Mojo, an AI-powered virtual teaching assistant, Coursemojo offers students personalized 1:1 support on curriculum-aligned activities.",Past,,2023.0,2024.0,https://www.newschools.org/wp-content/uploads/2024/10/Coursemojo-Inc-1.png,,,,,4.6,3,8,2,2,8,"Инструмент в первую очередь адаптирует учебные материалы и обеспечивает персонализированную обратную связь через ИИ-ассистента, но не предлагает ученикам контроля над траекторией обучения, совместной деятельности или геймификации."
1384,new-schools,Cultivating Literacy,cultivating-literacy-2,https://www.newschools.org/venture/cultivating-literacy-2/,Learning Solutions,https://www.cultivatingliteracy.org/,"Cultivating Literacy partners with schools to support dual-language TK-3rd grade students and their families by providing individualized reading support to improve accuracy and confidence. With the help of a bilingual reading coach and digital family portal, students engage in research-based reading activities that make learning enjoyable and strengthen the connection between school and home.",Past,,2019.0,2024.0,https://www.newschools.org/wp-content/uploads/2024/10/Cultivating-Literacy-1.png,,,,,4.6,2,5,6,3,7,"Продукт предлагает адаптивные материалы и обратную связь от коуча, но не предусматривает создания собственной траектории обучения учеником."
1385,new-schools,Da Vinci Schools,da-vinci-schools,https://www.newschools.org/venture/da-vinci-schools/,Innovative Schools,http://www.davincischools.org,"Da Vinci Schools operates six highly diverse schools in LA serving 2700+ students from 126 zip codes. We incorporate college/career readiness and project-based learning, LifeLaunch will blend high school, college credits, and career training focused on students aged 16-20. We envision a regional K-12 partnership across several districts, businesses and higher education, eliminating hurdles and stigmas often faced by the most marginalized learners.",,,,2022.0,,,,,,7.0,8,7,9,5,6,"Сильная персонализация траекторий и коллаборативное обучение за счет проектной деятельности и партнерств, однако геймификация и обратная связь не являются центральными элементами."
1387,new-schools,Data Research for Indigenous Futures (DRIF),data-research-for-indigenous-futures-drif,https://www.newschools.org/venture/data-research-for-indigenous-futures-drif/,Racial Equity,,Data Research for Indigenous futures (DRIF): Our vision is creating Indigenous futures by collaboratively working to uphold Indigenous data sovereignty so that Native children and youth are provided with life-changing possibilities and support to thrive in educational school systems across Indigenous North America.,,,,,,,,,,2.4,2,2,5,1,2,"Продукт фокусируется на суверенитете данных коренных народов, а не на персонализированном обучении, с минимальными элементами персонализации траектории, материалов и обратной связи."
1388,new-schools,DC Public Education Fund,dc-public-education-fund,https://www.newschools.org/venture/dc-public-education-fund/,Learning Solutions,http://www.dcedfund.org,"The DC Public Education Fund was founded in 2007 to help DC Public Schools address its most pressing challenges through organized philanthropy. As an independent organization, our team raises significant private dollars that incubate cutting-edge start-up ideas for students. To combat the lack of teacher engagement and a dearth of culturally affirming foundational literacy resources, through Readers Next Door DCPS trained their very own DCPS educators to create culturally relevant decodable books for students in grades K-2.",,,,2023.0,https://www.newschools.org/wp-content/uploads/2023/09/HighRes_EdFund_Logo-987x1024.jpg,,,,,3.2,2,7,4,1,2,"Проект фокусируется на создании культурно релевантных учебных материалов, но не предлагает персонализированных траекторий, геймификации или обратной связи."
1389,new-schools,Diffit,diffit,https://www.newschools.org/venture/diffit/,Learning Solutions,http://diffit.me,"Diffit helps teachers to instantly get differentiated lesson resources for any topic, article, or reading. This saves teachers tons of time – while helping all students, regardless of reading level, to access grade level curriculum.",,,,2023.0,https://www.newschools.org/wp-content/uploads/2023/09/diffit_logo_green-1.jpg,,,,,3.8,2,8,1,3,5,"Продукт ориентирован на учителя, а не на ученика, что ограничивает персонализацию траектории и совместную деятельность учащихся."
1390,new-schools,Diverse Learners Cooperative,diverse-learners-cooperative-2,https://www.newschools.org/venture/diverse-learners-cooperative-2/,Learning Differences,,"The Diverse Learners Cooperative will launch an 18-month, job-embedded special education certification program to increase the number of qualified special education teachers in local schools. In the first year, it will support a cohort of first-year special educators by providing job-embedded support and gathering targeted feedback to create responsive curricula and supportive certification pathways.",Past,,,2024.0,https://www.newschools.org/wp-content/uploads/2024/10/Diverse-Learners-Cooperative-1.png,,,,,4.0,4,4,6,1,5,"Программа в основном ориентирована на поддержку и обратную связь для учителей, но почти не затрагивает персонализацию траектории, адаптацию материалов и геймификацию."
1392,new-schools,Duquesne City School District,duquesne-city-school-district,https://www.newschools.org/venture/duquesne-city-school-district/,Innovative Schools,http://www.dukecitysd.org,"Offer rigorous & personalized learning, foster academic achievement, and support social-emotional development and career readiness through community partnerships, ultimately empowering excellence and growth for adults and student",Past,,,2023.0,https://www.newschools.org/wp-content/uploads/2023/09/Image-5-16-22-at-1.09-PM-Sue-Mariani-1.jpg,,,,,0.0,0,0,0,0,0,Нет доступной информации для оценки стартапа по критериям PMO.
1393,new-schools,Dyslexia Alliance for Black Children,dyslexia-alliance-for-black-children,https://www.newschools.org/venture/dyslexia-alliance-for-black-children/,Learning Differences,https://www.dyslexiaallianceforblackchildren.org/,"Dyslexia Alliance for Black Children works to eliminate the amplified inequities for Black children experiencing unaddressed dyslexia or related learning disabilities. Through collaborative efforts with families and educators, we inform, empower, and raise awareness of the need for early identification and intervention for Black children with dyslexia through sharing knowledge, dismantling systems of bias, and paving pathways to evidence-based reading instruction.",Past,,2020.0,,https://www.newschools.org/wp-content/uploads/2022/12/Dyslexia-Alliance-for-Black-Children.jpg,,,,,3.6,2,6,5,2,3,"Организация сосредоточена на адвокации и просвещении, а не на создании персонализированной образовательной платформы для учеников."
1394,new-schools,EarlyBird Education,earlybird-education-2,https://www.newschools.org/venture/earlybird-education-2/,Learning Solutions,https://earlybirdeducation.com/,"EarlyBird is a game-based assessment that screens for dyslexia as well as moderate reading risk that can be addressed through multi-tiered systems of support. Based on research conducted by the co-founders at Boston Children’s Hospital, Harvard Graduate School of Education, and the FSU-Florida Center for Reading Research, it can accurately identify students who might benefit from specialized support related to foundational reading skills. Such “early identification” practices are a key lever for supporting long-term literacy and health outcomes.",,,2020.0,2022.0,,,,,,3.0,2,5,1,4,3,"Продукт сфокусирован на скрининге дислексии и рисков чтения, а не на персонализированном обучении, поэтому показатели персонализации траектории и совместной деятельности низкие, а геймификация и визуализация лишь частично присутствуют как средство привлечения."
1395,new-schools,Earsight,earsight,https://www.newschools.org/venture/earsight/,Learning Solutions,http://earsight.co,Earsight builds tools to support struggling readers achieve automaticity in their reading.,Past,,,2023.0,https://www.newschools.org/wp-content/uploads/2023/09/Earsight-Logo.png,,,,,3.2,2,5,2,3,4,"Продукт ориентирован на автоматизацию чтения, но не предоставляет персонализированных траекторий и социальных функций, хотя материалы могут адаптироваться под уровень читателя."
1396,new-schools,Edge Fearless Learning,wheeling-country-day-school,https://www.newschools.org/venture/wheeling-country-day-school/,Learning Differences,https://www.edgefearlesslearning.com,Edge is an intensive intervention in literacy and math – virtually tutoring students with dyslexia-effects and developing an open learning management solution for dyscalculia and dyscalculia effects. Edge seeks to influence how children learn by also training teachers in the Science of Math.,Past,,,2023.0,https://www.newschools.org/wp-content/uploads/2023/09/edge_final-1024x518.jpg,,,,,4.2,2,7,3,3,6,"Продукт фокусируется на адаптации материалов под дислексию и дискалькулию, но не предоставляет ученику гибкости в построении собственной траектории обучения."
1397,new-schools,Edgecombe County Public Schools,edgecombe-county-public-schools,https://www.newschools.org/venture/edgecombe-county-public-schools/,Innovative Schools,https://www.ecps.us/,"Promote a community of learning that gives our students an “EDGE” in pursuit of the graduate aims. All scholars will graduate prepared to design their own futures, navigate change, and make the world a better place",Past,,,2023.0,https://www.newschools.org/wp-content/uploads/2023/09/ECPS-Futures-reimagined-Arlane-Gordon-Bray-1.png,,,,,2.8,3,2,5,2,2,"Продукт ориентирован на сообщество и цели выпускников, но не предоставляет персонализированных траекторий, адаптивного контента или геймификации."
1398,new-schools,EdLight,edlight-2,https://www.newschools.org/venture/edlight-2/,Learning Solutions,,"EdLight bridges educational gaps by building technology that connects teachers and learners. With a mission rooted in equity, EdLight empowers Black and Brown students to reach their full potential by providing educators with AI-driven tools that make instruction more student-centered.",Past,,2019.0,2024.0,https://www.newschools.org/wp-content/uploads/2024/10/EdLight-1.png,,,,,4.0,2,7,3,0,8,"Инструмент в первую очередь даёт учителям ИИ-инструменты для адаптации материалов и обратной связи, но не предоставляет учащимся возможности создавать свой путь обучения или игровые механики."
1399,new-schools,Education Evolving (Teacher Powered Schools),education-evolving-2,https://www.newschools.org/venture/education-evolving-2/,Teaching Reimagined,https://www.teacherpowered.org/,"The Teacher-Powered Coaching Initiative provides services for teams seeking to transform teacher roles and improve student outcomes using a teacher-powered model. The initiative supports educators in collaboratively designing and running schools, addressing key issues like working conditions, professional autonomy, and respect, enabling them to do their best work for students.",Past,,,2024.0,https://www.newschools.org/wp-content/uploads/2024/10/Education-Evolving-Teacher-Powered-Schools.png,,,,,2.4,2,1,5,1,3,"Продукт ориентирован на профессиональное развитие учителей, а не на персонализированное обучение учащихся, поэтому почти все инструменты PMO отсутствуют."
1400,new-schools,Education Partnership of the Permian Basin,education-partnership-of-the-permian-basin-2,https://www.newschools.org/venture/education-partnership-of-the-permian-basin-2/,Innovative Schools,https://educatepb.com/,"The Education Partnership of the Permian Basin in Texas is dedicated to improving educational outcomes across the region, supporting students from cradle to career.",Past,,,2024.0,https://www.newschools.org/wp-content/uploads/2024/10/Education-Partnership-of-the-Permian-Basin-1.png,,,,,2.2,2,2,3,2,2,"Организация представляет собой региональное партнёрство по улучшению образования, но не является цифровым продуктом с персонализированными инструментами PMO."
1401,new-schools,Education Reimagined,education-reimagined,https://www.newschools.org/venture/education-reimagined/,EDge,https://education-reimagined.org/,"Education Reimagined is a national non-profit dedicated to catalyzing the invention of a new public education system; one where the education system becomes the backbone to dynamic, interdependent ecosystems of learning that can uniquely, powerfully, and equitably serve, love, and include every child in the country.",Past,,,2023.0,https://www.newschools.org/wp-content/uploads/2023/09/ERlogo_Primary_FullColor_CMYK-2-1024x791.jpeg,,,,,6.6,9,7,8,4,5,"Проект направлен на создание персонализированных образовательных экосистем с высоким уровнем траектории и коллаборации, но геймификация и обратная связь пока слабо проработаны."
1402,new-schools,Edunomics Lab Georgetown University,edunomics-lab-georgetown-university,https://www.newschools.org/venture/edunomics-lab-georgetown-university/,EDge,http://www.edunomicslab.org,"Edunomics Lab is a Georgetown University-based research center dedicated to exploring and modeling complex education finance decisions to inform policy and practice. The center provides timely, relevant and actionable analysis of education finance policy and resource allocation strategy and decisions. As a response to the ESSER dollars, Edunomics Lab established a professional development and training experience tailored to school board members. The experience offers financial training to representatives from the communities that were the hardest hit from the COVID-19 pandemic.",,,2012.0,2022.0,,,,,,2.0,2,2,4,0,2,"Стартап ориентирован на обучение школьных советов, а не на персонализированное обучение учащихся, поэтому все инструменты PMO оцениваются низко."
1403,new-schools,edwell,edwell-2,https://www.newschools.org/venture/edwell-2/,EDge,https://edwell.org/,"Edwell is on a mission to ensure every teacher has the knowledge, skills, and resources to meet the mental health needs of their students and themselves– the two pieces of the school climate puzzle. They believe that to teach the whole student, you also need to support the whole teacher.",,,2020.0,2022.0,,,,,,2.4,2,3,4,1,2,"Продукт направлен на поддержку учителей, но не предоставляет персонализированных образовательных траекторий или адаптивного контента для учащихся."
